<?xml version="1.0" encoding="UTF-8"?>
<!DOCTYPE miroir SYSTEM "file:/Users/Daphne/Documents/GitHub/INU3011_TP/DTD/miroir.dtd">
<?xml-stylesheet type="text/xsl" href="file:/Users/Daphne/Documents/GitHub/INU3011_TP/XSLT/HTML.xsl"?>

<miroir ID="miroir12" photo="oui">
    <suiviModif>
        <création date="2021-01-22">
            <contributeur>Céline Hostiou</contributeur>
        </création>
    </suiviModif>
    <aspect couleur="or" forme="octogone">
        <style époque="vintage">
            <para>ce miroir dit « Makita », de la marque AMPM, est décoré de deux carrés en laiton superposés.</para>
        </style>
        <cadre>
            <para>le cadre en métal a fait l’objet d'une finition en laiton vieilli.</para></cadre>
    </aspect>
    <mesures>
        <hauteur>70</hauteur>
        <largeur>70</largeur>
    </mesures>
    <origine dateAcquisition="2017-02-13" moyenAcquisition="don">
        <commentaire>
            <para>Ce miroir vintage, comme le <lienInterne ID="miroir22">miroir
                22</lienInterne>, est proposé par les Galeries Lafayette. Sa fiche produit se trouve sous ce <lienExterne
                    URL="https://www.galerieslafayette.com/p/miroir+metal+finition+vieillie+makita-ampm/300407151727/347"
                    >lien</lienExterne>.</para>
        </commentaire>
    </origine>
    <valeur>En mai 2020, le prix du miroir était de 259 €.</valeur>
    <usage>
        <para>Ce miroir peut être indifféremment posé sur une commode, un meuble ou fixé au mur.</para>
    </usage>
</miroir>
