<?xml version="1.0" encoding="UTF-8"?>
<!DOCTYPE miroir SYSTEM "file:/Users/Daphne/Documents/GitHub/INU3011_TP/DTD/miroir.dtd">
<?xml-stylesheet type="text/xsl" href="file:/Users/Daphne/Documents/GitHub/INU3011_TP/XSLT/HTML.xsl"?>

<miroir ID="miroir22" photo="oui">
    <suiviModif>
        <création date="2021-02-03">
            <contributeur>Céline Hostiou</contributeur>
        </création>
    </suiviModif>
    <aspect couleur="argent" forme="rond">
        <style époque="vintage">
            <para>Ce miroir rond date des années 1960. Il a pour matériaux le verre et
            le cristal.</para>
        </style>
        <cadre>
            <para>Le cadre est gravé et biseauté.</para>
        </cadre>
    </aspect>
    <mesures>
        <hauteur>62</hauteur>
        <largeur>62</largeur>
    </mesures>
    <origine dateAcquisition="2017-12-15" moyenAcquisition="achat" prixAchatEuros="250">
        <commentaire>
            <para>Ce miroir circulaire, comme le <lienInterne ID="miroir50">miroir 50</lienInterne>,
                a été acquis auprès d'un brocanteur de Saint-Ouen, situé près de Paris. Bien que
                d'occasion, il ne présente ni fêlés ni impacts. Il est visible sous ce <lienExterne
                    URL="https://www.selency.fr/produit/55V2Q3Y2/miroir-rond-grave-et-biseaute-annees-60.html"
                    >lien</lienExterne>.</para>
        </commentaire>
    </origine>
    <valeur>En mai 2020, le prix du miroir était de 250 euros.</valeur>
    <usage>
        <para>Ce miroir peut être fixé dans n'importe quelle pièce du logement, dans un vestibule, un
            couloir.</para>
    </usage>
</miroir>
