<?xml version="1.0" encoding="UTF-8"?>
<!DOCTYPE miroir SYSTEM "file:/Users/Daphne/Documents/GitHub/INU3011_TP/DTD/miroir.dtd">
<?xml-stylesheet type="text/xsl" href="file:/Users/Daphne/Documents/GitHub/INU3011_TP/XSLT/HTML.xsl"?>

<miroir ID="miroir26" photo="oui">
    <suiviModif>
        <création date="2021-02-12">
            <contributeur>Céline Hostiou</contributeur>
        </création>
        <modification date="2021-03-01">
            <contributeur>Daphné Mathelier</contributeur>
        </modification>
    </suiviModif>
    <aspect couleur="noir" forme="triangle">
        <style époque="contemporain">
            <para>Ce miroir triangulaire de marque "Tikamoon" et de modèle "Maho"
                est rehaussé de quatre barres superposées, ouvragées. Celles-ci épousent l'angle supérieur du triangle.</para>
        </style>
        <cadre>
            <para>Le cadre, en métal peint, apporte une touche industrielle et graphique à la pièce où il est exposé.</para>
        </cadre>
    </aspect>
    <mesures>
        <hauteur>60</hauteur>
        <largeur>60</largeur>
        <profondeur>4</profondeur>
        <poids>8</poids>
    </mesures>
    <origine dateAcquisition="2018-02-01" moyenAcquisition="achat" prixAchatEuros="149">
        <commentaire>
            <para>Ce miroir triangulaire, comme le <lienInterne ID="miroir38">miroir
                    38</lienInterne>, a été conçu par l'entreprise Tikamoon, située dans le nord de
                la France, à Lille. Celle-ci s'inscrit dans un créneau de meubles durables. Elle a
                développé une chaîne de production à l'impact environnemental limité. La fiche produit du miroir est consultable sous ce 
                    <lienExterne
                        URL="https://www.tikamoon.com/art-miroir-triangulaire-en-m-tal-60-maho-2782.htm"
                    >lien</lienExterne>.</para>
        </commentaire>
    </origine>
    <valeur>En mai 2020, le prix du miroir était de 149 euros.</valeur>
    <usage>
        <para>Ce miroir peut agrémenté toutes les pièces de la maison.</para>
    </usage>
</miroir>
