<?xml version="1.0" encoding="UTF-8"?>
<!DOCTYPE miroir SYSTEM "file:/Users/Daphne/Documents/GitHub/INU3011_TP/DTD/miroir.dtd">
<?xml-stylesheet type="text/xsl" href="file:/Users/Daphne/Documents/GitHub/INU3011_TP/XSLT/HTML.xsl"?>

<miroir ID="miroir17" photo="oui">
    <suiviModif>
        <création date="2021-01-28">
            <contributeur>Céline Hostiou</contributeur>
        </création>
        <modification date="2021-03-01">
            <contributeur>Daphné Mathelier</contributeur>
        </modification>
    </suiviModif>
    <aspect couleur="or" forme="rond">
        <style époque="contemporain">
            <para>ce miroir appelé « Capsule » se décompose en deux parties : un petit cercle
            surmontant un plus grand. Ceux-ci sont unis par une fine tige ovoïde.</para>
        </style>
        <cadre>
            <para>le cadre est en métal doré.</para>
        </cadre>
    </aspect>
    <mesures>
        <hauteur>66</hauteur>
        <largeur>41</largeur>
    </mesures>
    <origine dateAcquisition="2017-04-01" moyenAcquisition="achat" prixAchatEuros="62">
        <commentaire>
            <para>Ce miroir circulaire, comme le <lienInterne ID="miroir22">miroir
                22</lienInterne>, a été acheté dans l’enseigne de décoration québécoise Zone. Il est
                visible sous ce <lienExterne
                    URL="https://www.zonemaison.com/fr/products/deco/miroirs/capsule/23754/miroir-double-or"
                    >lien</lienExterne>.</para>
        </commentaire>
    </origine>
    <valeur>En mai 2020, le prix du miroir était de 92 $CAN (62 €).</valeur>
    <usage>
        <para>Ce miroir aurait avantage à être placé dans une pièce lumineuse, pour l’éclat de son cadre doré.</para>
    </usage>
</miroir>
