<?xml version="1.0" encoding="UTF-8"?>
<!DOCTYPE miroir SYSTEM "file:/Users/celinehostiou/Dropbox/Mon%20Mac%20(MacBook%20Air%20de%20C%C3%A9line)/Documents/DESS%20%C3%A9dition%20num%C3%A9rique%20UdeM/Hiver_2021/-%20INU3011_Documents_structur%C3%A9s/-%20%C3%89valuations/-%20TP3_Mod%C3%A9lisation_pr%C3%A9liminaire/Modele/miroir.dtd">
<miroir ID="miroir29" photo="oui">
    <suiviModif>
        <creation date="2021-02-27">
            <contributeur>Céline Hostiou</contributeur>
        </creation>
        <modification date="2021-02-28">
            <contributeur>Daphné Mathelier</contributeur>
        </modification>
    </suiviModif>
    <aspect couleur="noir" forme="rectangle">
        <style epoque="contemporain">Ce miroir rectangulaire dit "Karmsund", vendu par la chaîne de
            magasins Ikea, se déploie en triptyque. Il dispose de pieds et est coiffé d'une
            ornementation, tous en fer forgé, tous détachables.</style>
        <cadre>Le cadre est en acier galvanisé noir.</cadre>
    </aspect>
    <mesures>
        <hauteur>80</hauteur>
        <largeur>74</largeur>
        <profondeur>6</profondeur>
        <poids>7,10</poids>
    </mesures>
    <origine moyenAcquisition="achat" prixAchat="49,99">
        <dateAcquisition>2020-05-12</dateAcquisition>
        <commentaire>
            <para>Ce miroir rectangulaire, comme le <lienInterne ID="miroir42">miroir
                    42</lienInterne>, a été acheté chez Ikea. La fiche de ce produit est consultable
                sous ce <lienExterne
                    URL="https://www.ikea.com/ca/fr/p/karmsund-miroir-de-table-noir-20294983/"
                    >lien</lienExterne>.</para>
        </commentaire>
    </origine>
    <valeur>En mai 2020, le prix du miroir était de 49,99 dollars.</valeur>
    <usage>Des crochets situés derrière les miroirs latéraux permettent de ranger facilement ses
        bijoux. Les sections pivotantes du miroir permettent de s'admirer sous différents angles.
        Peut être installé dans toutes les pièces de la maison, dont la salle de bains, car il a été
        testé et approuvé pour cet usage.</usage>
</miroir>
