<?xml version="1.0" encoding="UTF-8"?>
<!DOCTYPE miroir SYSTEM "file:/Users/celinehostiou/Dropbox/Mon%20Mac%20(MacBook%20Air%20de%20C%C3%A9line)/Documents/DESS%20%C3%A9dition%20num%C3%A9rique%20UdeM/Hiver_2021/-%20INU3011_Documents_structur%C3%A9s/-%20%C3%89valuations/-%20TP3_Mod%C3%A9lisation_pr%C3%A9liminaire/Modele/miroir.dtd">
<miroir ID="miroir45" photo="oui">
    <suiviModif>
        <creation date="2021-02-06">
            <contributeur>Céline Hostiou</contributeur>
        </creation>
        <modification date="2021-03-09">
            <contributeur>Daphné Mathelier</contributeur>
        </modification>
    </suiviModif>
    <aspect couleur="vert" forme="ovale">
        <style epoque="XXe siècle">Ce miroir moderne et coloré est créé et signé par l'artiste
            américain David Marshall. Conçu dans les années 1990, il est fait entièrement de verre
            sculpté. </style>
        <cadre>Un héron vert d'eau orne son pourtour.</cadre>
    </aspect>
    <mesures>
        <hauteur>99</hauteur>
        <largeur>71</largeur>
        <profondeur>3</profondeur>
    </mesures>
    <origine moyenAcquisition="achat" prixAchat="3500">
        <dateAcquisition>2020-09-17</dateAcquisition>
        <commentaire>
            <para>Ce miroir a été acquis auprès de la galerie Majdeltier, située dans le
                nord de la France, à Tourcoing, tout comme le <lienInterne ID="miroir38">miroir
                    38</lienInterne> de la collection. Le donataire comptait parmi ses habitués. Son
                catalogue d'oeuvres d'art du XXe siècle, son domaine de spécialité, est consultable
                sous ce <lienExterne URL="https://www.proantic.com/galerie/majdeltier/"
                    >lien</lienExterne>.</para>
        </commentaire>
    </origine>
    <valeur>En septembre 2020, le prix du miroir était de 3500 €.</valeur>
    <usage>Ce miroir est voué à prendre appui sur un buffet, une commode, dans un salon, une salle à manger.</usage>
</miroir>
