<?xml version="1.0" encoding="UTF-8"?>
<!DOCTYPE miroir SYSTEM "file:/Users/celinehostiou/Dropbox/Mon%20Mac%20(MacBook%20Air%20de%20C%C3%A9line)/Documents/DESS%20%C3%A9dition%20num%C3%A9rique%20UdeM/Hiver_2021/-%20INU3011_Documents_structur%C3%A9s/-%20%C3%89valuations/-%20TP3_Mod%C3%A9lisation_pr%C3%A9liminaire/Modele/miroir.dtd">
<miroir ID="miroir17" photo="oui">
    <suiviModif>
        <creation date="2021-02-08">
            <contributeur>Céline Hostiou</contributeur>
        </creation>
        <modification date="2021-02-09">
            <contributeur>Daphné Mathelier</contributeur>
        </modification>
    </suiviModif>
    <aspect couleur="or" forme="rond">
        <style epoque="contemporain">Ce miroir appelé "Capsule" se décompose en deux parties: un petit cercle
            surmontant un plus grand. Ceux-ci sont unis par une fine tige ovoïde.</style>
        <cadre>Le cadre est en métal doré.</cadre>
    </aspect>
    <mesures>
        <hauteur>66</hauteur>
        <largeur>41</largeur>
    </mesures>
    <origine moyenAcquisition="achat" prixAchat="92">
        <dateAcquisition>2020-04-01</dateAcquisition>
        <commentaire>
            <para>Ce miroir circulaire, comme le <lienInterne ID="miroir22">miroir
                22</lienInterne>, a été acheté dans l'enseigne de décoration québécoise Zone. Il est
                visible sous ce <lienExterne
                    URL="https://www.zonemaison.com/fr/products/deco/miroirs/capsule/23754/miroir-double-or"
                    >lien</lienExterne>.</para>
        </commentaire>
    </origine>
    <valeur>En mai 2020, le prix du miroir était de 92 dollars.</valeur>
    <usage>Ce miroir aurait avantage à être placé dans une pièce lumineuse, pour l'éclat de son cadre doré.</usage>
</miroir>
