<?xml version="1.0" encoding="UTF-8"?>
<!DOCTYPE miroir SYSTEM "file:/Users/Daphne/Documents/GitHub/INU3011_TP/DTD/miroir.dtd">
<miroir ID="miroir38" photo="oui">
    <suiviModif>
        <création date="2021-03-01">
            <contributeur>Céline Hostiou</contributeur>
        </création>
        <modification date="2021-04-09">
            <contributeur>Daphné Mathelier</contributeur>
        </modification>
    </suiviModif>
    <aspect couleur="transparent" forme="triangle">
        <style époque="XXe siècle">
            <para>Ce miroir triangulaire est de style Art Déco. Il présente une
            belle mise en abyme avec son petit miroir intégré au tain mercurisé de couleur
            bronze.</para>
        </style>
        <cadre>
            <para>Il est encadré d'un sillon qui crée un mince contour biseauté.</para>
        </cadre>
    </aspect>
    <mesures>
        <hauteur>76</hauteur>
        <largeur>59</largeur>
        <profondeur>1</profondeur>
    </mesures>
    <origine dateAcquisition="2019-04-07" moyenAcquisition="achat" prixAchatEuros="290">
        <commentaire>
            <para>Ce miroir a été acquis auprès de la galerie Majdeltier, située dans le nord de la
                France, à Tourcoing, tout comme le <lienInterne ID="miroir45">miroir
                    45</lienInterne> de la collection. Le donataire comptait parmi ses habitués. Son
                catalogue d'oeuvres d'art du XXe siècle, son domaine de spécialité, est consultable
                sous ce <lienExterne URL="https://www.proantic.com/galerie/majdeltier/"
                    >lien</lienExterne>.</para>
        </commentaire>
    </origine>
    <valeur>En juin 2020, le prix du miroir était de 290 €.</valeur>
    <usage>
        <para>Ce miroir est voué à être fixé à un mur, sans meuble dessous, pour bien mettre en valeur
            sa forme triangulaire tombante.</para>
    </usage>
</miroir>
