<?xml version="1.0" encoding="UTF-8"?>
<!DOCTYPE miroir SYSTEM "file:/Users/Daphne/Documents/GitHub/INU3011_TP/DTD/miroir.dtd">
<?xml-stylesheet type="text/xsl" href="file:/Users/Daphne/Documents/GitHub/INU3011_TP/XSLT/HTML.xsl"?>

<miroir ID="miroir9" photo="oui">
    <suiviModif>
        <création date="2021-01-15">
            <contributeur>Céline Hostiou</contributeur>
        </création>
        <modification date="2021-02-16">
            <contributeur>Daphné Mathelier</contributeur>
        </modification>
    </suiviModif>
    <aspect couleur="transparent" forme="rond">
        <style époque="vintage">
            <para>ce miroir circulaire est agrémenté de trois rangées de perles de verre scintillantes.</para>
        </style>
        <cadre>
            <para>des bijoux ornent le pourtour.</para>
        </cadre>
    </aspect>
    <mesures>
        <hauteur>30</hauteur>
        <largeur>30</largeur>
        <profondeur>4,45</profondeur>
        <poids>6,35</poids>
    </mesures>
    <origine dateAcquisition="2017-02-13" moyenAcquisition="don">
        <commentaire>
            <para>Ce miroir vintage, comme le <lienInterne ID="miroir17">miroir
                17</lienInterne>, a été conçu par The Tangerine Mirror Company. Voir sa fiche produit chez <lienExterne
                    URL="https://www.homedepot.ca/produit/the-tangerine-mirror-company-bijou-miroir-rond/1001384871"
                    >Home Depot</lienExterne>.</para>
        </commentaire>
    </origine>
    <valeur>En mai 2020, le prix du miroir était de 99 $CAN (66 €).</valeur>
    <usage>
        <para>Mieux vaut fixer ce miroir dans une pièce très claire afin de rehausser l’éclat des perles de verre qui y sont serties.</para>
    </usage>
</miroir>
