<?xml version="1.0" encoding="UTF-8"?>
<!DOCTYPE miroir SYSTEM "file:/Users/Daphne/Documents/GitHub/INU3011_TP/DTD/miroir.dtd">
<?xml-stylesheet type="text/xsl" href="file:/Users/Daphne/Documents/GitHub/INU3011_TP/XSLT/HTML.xsl"?>

<miroir ID="miroir34" photo="oui">
    <suiviModif>
        <création date="2021-02-27">
            <contributeur>Céline Hostiou</contributeur>
        </création>
    </suiviModif>
    <aspect couleur="transparent" forme="rond">
        <style époque="contemporain">
            <para>ce miroir rond dit « Forest » a été conçu par la designer Sophie
            Larger. Il est à poser par le détenteur sur une base où se dressent des barres
            verticales en métal, avec finition en doré.</para>
        </style>
        <cadre>
            <para>ces barres consituent un cadre décalé, dont le miroir semble glisser.</para>
        </cadre>
    </aspect>
    <mesures>
        <hauteur>60</hauteur>
        <largeur>44</largeur>
        <profondeur>10</profondeur>
    </mesures>
    <origine dateAcquisition="2018-09-19" moyenAcquisition="achat" prixAchatEuros="825">
        <commentaire>
            <para>Ce miroir circulaire, comme le <lienInterne ID="miroir50">miroir 50</lienInterne>,
                a été acheté chez Roche Bobois, l’un des leaders mondiaux du mobilier design haut de
                gamme. La fiche de ce produit est consultable sous ce <lienExterne
                    URL="https://www.roche-bobois.com/fr-CA/produit/forest-miroir"
                    >lien</lienExterne>.</para>
        </commentaire>
    </origine>
    <valeur>En mai 2020, le prix du miroir était de 1230 $CAN (825 €).</valeur>
    <usage>
        <para>Ce miroir est voué à être fixé sur une commode, un buffet, un secrétaire.</para>
    </usage>
</miroir>
